{
  "$schema": "https://json-schema.org/draft/2020-12/schema",
  "$id": "https://schemas.runx.ai/runx/security/exact-cve-verification/v1.json",
  "x-runx-packet-id": "runx.security.exact_cve_verification.v1",
  "type": "object",
  "required": ["schema", "verified_at", "target", "dependency_scope", "verified", "exact_dependencies_replayed", "verified_findings", "false_hits", "missing_hits", "withdrawn_hits_excluded", "replay"],
  "properties": {
    "schema": { "const": "runx.security.exact_cve_verification.v1" },
    "verified_at": { "type": "string", "minLength": 1 },
    "target": { "type": "object", "additionalProperties": true },
    "dependency_scope": { "enum": ["direct-production", "all-installed"] },
    "verified": { "type": "boolean" },
    "exact_dependencies_replayed": { "type": "integer", "minimum": 0 },
    "verified_findings": { "type": "integer", "minimum": 0 },
    "false_hits": { "type": "integer", "minimum": 0 },
    "missing_hits": { "type": "integer", "minimum": 0 },
    "withdrawn_hits_excluded": { "type": "integer", "minimum": 0 },
    "replay": {
      "type": "array",
      "items": {
        "type": "object",
        "required": ["dependency", "exact_version", "reported_advisory_ids", "replayed_advisory_ids", "exact_set_match"],
        "properties": {
          "dependency": { "type": "string", "minLength": 1 },
          "exact_version": { "type": "string", "minLength": 1 },
          "reported_advisory_ids": {
            "type": "array",
            "items": { "type": "string", "minLength": 1 }
          },
          "replayed_advisory_ids": {
            "type": "array",
            "items": { "type": "string", "minLength": 1 }
          },
          "exact_set_match": { "type": "boolean" }
        },
        "additionalProperties": true
      }
    },
    "artifact": {
      "type": "object",
      "required": ["path", "sha256"],
      "properties": {
        "path": { "type": "string", "minLength": 1 },
        "sha256": { "type": "string", "pattern": "^[0-9a-f]{64}$" }
      },
      "additionalProperties": true
    }
  },
  "additionalProperties": true
}
