{
  "schema": "runx.security.exact_cve_verification.v1",
  "verified_at": "2026-07-15T00:46:18.620Z",
  "target": {
    "commit": "c5cb68a7084e4ae7dcc60e6a98768720a81841e8",
    "lockfile_sha256": "b9ed49893a9d3bcf6fe567cd38fe8168850591e0018f19d3bb0d1f80a4c2eecc",
    "lockfile_url": "https://raw.githubusercontent.com/OWASP/NodeGoat/c5cb68a7084e4ae7dcc60e6a98768720a81841e8/package-lock.json",
    "lockfile_version": 2,
    "name": "OWASP NodeGoat",
    "repo": "https://github.com/OWASP/NodeGoat"
  },
  "dependency_scope": "direct-production",
  "verified": true,
  "exact_dependencies_replayed": 16,
  "verified_findings": 13,
  "false_hits": 0,
  "missing_hits": 0,
  "withdrawn_hits_excluded": 0,
  "replay": [
    {
      "dependency": "bcrypt-nodejs",
      "exact_version": "0.0.3",
      "reported_advisory_ids": [],
      "replayed_advisory_ids": [],
      "exact_set_match": true
    },
    {
      "dependency": "body-parser",
      "exact_version": "1.18.3",
      "reported_advisory_ids": [
        "GHSA-qwcr-r2fm-qrc7"
      ],
      "replayed_advisory_ids": [
        "GHSA-qwcr-r2fm-qrc7"
      ],
      "exact_set_match": true
    },
    {
      "dependency": "consolidate",
      "exact_version": "0.14.5",
      "reported_advisory_ids": [],
      "replayed_advisory_ids": [],
      "exact_set_match": true
    },
    {
      "dependency": "csurf",
      "exact_version": "1.9.0",
      "reported_advisory_ids": [],
      "replayed_advisory_ids": [],
      "exact_set_match": true
    },
    {
      "dependency": "dont-sniff-mimetype",
      "exact_version": "1.0.0",
      "reported_advisory_ids": [],
      "replayed_advisory_ids": [],
      "exact_set_match": true
    },
    {
      "dependency": "express",
      "exact_version": "4.16.4",
      "reported_advisory_ids": [
        "GHSA-qw6h-vgh9-j6wx",
        "GHSA-rv95-896h-c2vc"
      ],
      "replayed_advisory_ids": [
        "GHSA-qw6h-vgh9-j6wx",
        "GHSA-rv95-896h-c2vc"
      ],
      "exact_set_match": true
    },
    {
      "dependency": "express-session",
      "exact_version": "1.15.6",
      "reported_advisory_ids": [],
      "replayed_advisory_ids": [],
      "exact_set_match": true
    },
    {
      "dependency": "forever",
      "exact_version": "2.0.0",
      "reported_advisory_ids": [],
      "replayed_advisory_ids": [],
      "exact_set_match": true
    },
    {
      "dependency": "helmet",
      "exact_version": "2.3.0",
      "reported_advisory_ids": [],
      "replayed_advisory_ids": [],
      "exact_set_match": true
    },
    {
      "dependency": "marked",
      "exact_version": "0.3.5",
      "reported_advisory_ids": [
        "GHSA-5v2h-r2cx-5xgj",
        "GHSA-7px7-7xjx-hxm8",
        "GHSA-p9wx-2529-fp83",
        "GHSA-rrrm-qjm4-v8hf",
        "GHSA-vfvf-mqq8-rwqc",
        "GHSA-x5pg-88wf-qq4p"
      ],
      "replayed_advisory_ids": [
        "GHSA-5v2h-r2cx-5xgj",
        "GHSA-7px7-7xjx-hxm8",
        "GHSA-p9wx-2529-fp83",
        "GHSA-rrrm-qjm4-v8hf",
        "GHSA-vfvf-mqq8-rwqc",
        "GHSA-x5pg-88wf-qq4p"
      ],
      "exact_set_match": true
    },
    {
      "dependency": "mongodb",
      "exact_version": "2.2.36",
      "reported_advisory_ids": [
        "GHSA-mh5c-679w-hh4r"
      ],
      "replayed_advisory_ids": [
        "GHSA-mh5c-679w-hh4r"
      ],
      "exact_set_match": true
    },
    {
      "dependency": "needle",
      "exact_version": "2.2.4",
      "reported_advisory_ids": [],
      "replayed_advisory_ids": [],
      "exact_set_match": true
    },
    {
      "dependency": "node-esapi",
      "exact_version": "0.0.1",
      "reported_advisory_ids": [],
      "replayed_advisory_ids": [],
      "exact_set_match": true
    },
    {
      "dependency": "serve-favicon",
      "exact_version": "2.5.0",
      "reported_advisory_ids": [],
      "replayed_advisory_ids": [],
      "exact_set_match": true
    },
    {
      "dependency": "swig",
      "exact_version": "1.4.2",
      "reported_advisory_ids": [
        "GHSA-2rq5-699j-x7p6"
      ],
      "replayed_advisory_ids": [
        "GHSA-2rq5-699j-x7p6"
      ],
      "exact_set_match": true
    },
    {
      "dependency": "underscore",
      "exact_version": "1.9.1",
      "reported_advisory_ids": [
        "GHSA-cf4h-3jhx-xvhq",
        "GHSA-qpx9-hpmf-5gmw"
      ],
      "replayed_advisory_ids": [
        "GHSA-cf4h-3jhx-xvhq",
        "GHSA-qpx9-hpmf-5gmw"
      ],
      "exact_set_match": true
    }
  ]
}
